{
  "$schema": "http://json-schema.org/draft-07/schema#",
  "title": "守護霊獣一覧 スキーマ",
  "type": "array",
  "items": {
    "type": "object",
    "required": ["prince", "name"],
    "properties": {
      "prince": { "type": "string", "minLength": 1 },
      "name": { "type": "string", "minLength": 1 },
      "appearance": { "type": ["string", "null"] },
      "nen_type": { "type": ["string", "null"] },
      "ability": { "type": ["string", "null"] },
      "image": { "type": ["string", "null"] },
      "usage_image": { "type": ["string", "null"] },
      "usage_image_source": { "type": ["string", "null"] },
      "source_event_ids": { "type": "array", "uniqueItems": true, "items": { "type": "string", "pattern": "^E[0-9]{3}-[0-9]{3}$" } }
    }
  }
}
